ID,Title,Created At,Closed At,Issues,Errors,Messages
1267,Malformed Filenames Throw Exception on Upload,2014-12-10T07:54:47Z,2015-01-18T17:09:13Z,httputil,,
1266,basic proxy support for simple http client,2014-12-10T07:02:51Z,2015-02-16T09:21:42Z,httpclient,,
1265,Potential SSL slowdowns?,2014-12-05T20:58:25Z,2015-09-29T16:08:14Z,netutil,,
1264,swap platform.system() for sys.platform,2014-12-05T06:41:07Z,2014-12-05T14:51:00Z,,,
1263,replace call to platform.system() with sys.platform,2014-12-05T06:33:49Z,2014-12-05T14:52:01Z,,,
1262,Better template exception,2014-12-03T14:29:54Z,2015-07-04T18:35:42Z,template,,
1261,fix matching an IPv6 address as host,2014-11-25T14:29:25Z,2014-12-16T02:22:52Z,,,
1260,use the same protocol when redirecting to default host,2014-11-25T14:28:54Z,2014-11-30T17:34:56Z,,,
1259,Customize how to get real IPs,2014-11-25T12:29:17Z,2014-11-30T21:49:08Z,,,
1258,http client: option to not raise errors,2014-11-21T19:23:50Z,2014-12-06T02:20:18Z,,,
1257,pip install tornado yields error,2014-11-21T18:20:15Z,2014-11-22T00:34:43Z,,ImportError,ImportError: DLL load failed: %1 is not a valid Win32 application.
1256,Update blog.py,2014-11-21T07:21:50Z,2015-01-12T01:09:45Z,,,
1255,Update structure.rst,2014-11-20T00:56:22Z,2014-12-06T02:27:59Z,,,
1254,call AsyncHTTPClient in the requestHandler get method make all the unittestcase  raise timeout Exception,2014-11-19T06:33:44Z,2014-11-21T11:01:56Z,,,
1253,unittest with @gen_test and ioloop.run_sync raise timeout exception.,2014-11-17T03:49:39Z,2014-11-18T03:09:25Z,,TimeoutError,TimeoutError: Operation timed out after None seconds
1252,AsyncHTTPClient fails if fetch is initiated before IOLoop.start,2014-11-15T22:09:56Z,2015-01-18T18:18:35Z,ioloop,,
1251,kqueue on BSD fails with Mock transport,2014-11-14T13:20:42Z,2014-11-14T23:02:06Z,,,
1250,proposal: deprecate json_encode,2014-11-13T09:36:43Z,2014-12-06T02:01:31Z,,,
1249,about tornad design,2014-11-12T13:51:56Z,2014-11-12T17:08:00Z,,,
1248,Multiple cookie with the same name,2014-11-10T15:53:32Z,2014-11-11T04:20:10Z,,,
1247,Typo in docs about max_age_days for secure cookies,2014-11-10T04:34:40Z,2014-11-11T04:13:56Z,,,
1246,Cleanup Subprocess when tearing down AsyncTestCase,2014-11-08T19:44:27Z,2014-11-09T15:59:30Z,,,
1245,Subprocess' ioloop can be replaced if it's closed.,2014-11-07T01:26:18Z,2014-11-09T16:05:04Z,,,
1244,Drop callbacks added after ioloop is closed.,2014-11-06T21:10:37Z,2015-09-28T01:35:11Z,ioloop,,
1243,Anyway to modify sec_websocket_protocol using websocket_connect()?,2014-11-06T20:48:37Z,,,,
1242,WebSocketHandler open method has to receive arguments?,2014-11-06T01:57:06Z,2014-11-08T21:37:53Z,,,
1241,Find real option definer.,2014-11-03T00:55:58Z,2014-11-05T14:36:28Z,,,
1240,"StaticFileHandler throws exception ""missing 1 required positional argument: 'path'""",2014-11-02T10:55:20Z,2014-11-02T10:57:58Z,,,
1239,enhencment: auto reload with checking file finished uploading and syntax checking,2014-11-02T01:07:01Z,,other,,
1238,Check handler is class in URLSpec.,2014-11-01T01:10:32Z,2014-11-05T14:40:12Z,,,
1237,AsyncTestCase.wait(condition) doesn't work if stop called too soon,2014-10-31T01:18:44Z,,testing,,
1236,`tornado.escape.url_escape` does not work when used inside urlspec,2014-10-30T02:31:45Z,2014-10-30T16:21:25Z,,,
1235,tornado web send_error treats exceptions as lists,2014-10-29T21:10:13Z,2014-10-31T13:14:41Z,,,
1234,Enable Sourcegraph,2014-10-28T14:25:08Z,2014-10-28T14:28:02Z,,,
1233,[feature] Any Future,2014-10-27T11:14:23Z,2015-01-18T22:32:10Z,gen,,
1232,Enable Sourcegraph,2014-10-27T09:47:13Z,2014-10-28T14:14:07Z,,,
1231,fixed error message in iostream,2014-10-26T12:11:52Z,2014-10-27T00:52:16Z,,,
1230,"In some cases, on OS X on_close is not being called for terminated websocket connections",2014-10-24T21:08:16Z,2014-10-27T17:08:05Z,,,
1229,Typo on line tornado/iostream.py:334,2014-10-24T06:27:41Z,2014-10-27T00:52:16Z,,,
1228,test_gaierror failures on OSX,2014-10-23T01:03:54Z,2015-01-12T00:59:39Z,,AssertionError,AssertionError: False is not true
1227,adding hint to supervisord minfds,2014-10-20T15:07:09Z,2014-10-27T01:16:41Z,,,
1226,deleted,2014-10-18T17:28:57Z,2014-11-03T23:11:40Z,,,
1225,Update running.rst,2014-10-17T14:12:18Z,2014-10-18T15:48:00Z,,,
1224,concurrency errors running multiple processes together with a process pool executor,2014-10-14T21:08:10Z,2015-01-12T00:56:39Z,,KeyError,KeyError: 0
1223,Exceptions in data_received() (while using @stream_request_body) are not handled properly,2014-10-14T19:55:37Z,,web,,
1222,Fixed example in doc string,2014-10-13T12:06:05Z,2014-10-14T02:13:31Z,,,
1221,Testing in python 3.4 fails when Deps = True,2014-10-12T04:55:10Z,2014-10-12T10:41:27Z,,,
1220,"Revert ""Disable pycares tests on travis due to ipv6 issues.""",2014-10-11T23:50:43Z,2015-01-12T01:08:34Z,,,
1219,Add timeouts to TCPClient,2014-10-11T15:29:16Z,2017-07-16T03:13:15Z,tcpclient,,
1218,Correctly parse If-None-Match header,2014-10-11T15:28:03Z,2015-03-06T03:56:48Z,web,,
1217,Fix an example in docstring of HTTPServer,2014-10-10T10:11:47Z,2014-10-10T14:40:03Z,,,
1216,url_concat: Enable doseq for urlencode,2014-10-04T07:50:44Z,2014-10-05T19:43:51Z,,,
1215,Fix typo,2014-10-04T02:42:44Z,2014-10-04T16:29:12Z,,,
1214,check for fd in _handlers before calling it,2014-10-03T11:08:51Z,2015-07-05T18:07:58Z,ioloop,,
1213,Body should be allowed to be empty for PUT,2014-10-01T14:27:59Z,2014-10-03T13:27:09Z,,AssertionError,"AssertionError: Body must not be empty for ""PUT"" request"
1212,OAuth2,2014-09-30T06:46:09Z,2015-06-28T20:44:40Z,auth,,
1211,gen.Locker implementation,2014-09-29T14:56:35Z,2014-09-29T17:55:17Z,,,
1210,on_close handler doesn't seem to be called upon interruption to websocket connection,2014-09-26T20:44:45Z,2014-09-28T19:52:35Z,,,
1209,Raising HTTPError in streaming handler drops connection,2014-09-25T21:52:33Z,2014-09-26T03:52:34Z,,,
1208,StreamClosedError,2014-09-23T22:48:52Z,2014-10-12T03:34:37Z,,,
1207,Add some unit tests for tornado.locale,2014-09-23T12:04:28Z,2014-09-26T01:27:49Z,,,
1206,Add a unit test for tornado.web.RedirectHandler,2014-09-23T11:50:16Z,2014-09-26T01:25:46Z,,,
1205,Implement function returning Future aroud Subprocess.set_exit_callback,2014-09-23T06:40:54Z,2015-04-18T18:14:14Z,process,,
1204,exclude tcpclient_test.do_test_connect() from nose,2014-09-21T22:20:26Z,2014-09-26T01:19:00Z,,,
1203,tornado.test.tcpclient_test fails in nosetest3,2014-09-21T22:18:33Z,2014-09-26T01:19:05Z,,,
1202,tornado escape json_encode problem,2014-09-21T07:14:35Z,2014-09-21T14:52:55Z,,,
1201,asyncio's ProactorEventLoop does not work with the AsyncIOMainLoop adapter,2014-09-20T07:58:57Z,2014-09-21T16:45:14Z,"asyncio, windows",,
1200,Tornado not closing keep-alive sockets,2014-09-19T21:04:37Z,2014-09-19T23:30:01Z,,,
1199,Normalizing of HTTP headers problem,2014-09-18T10:15:28Z,2014-09-18T13:23:40Z,,,
1198,Fix for #1123,2014-09-18T09:22:02Z,2014-10-14T03:09:25Z,,,
1197,Remove unused module in tornado.platform.asyncio,2014-09-18T01:37:22Z,2014-09-18T02:04:29Z,,,
1196,Websocket error when writing faster,2014-09-17T13:29:42Z,2015-01-24T22:44:32Z,websocket,,
1195,tornado template problem？,2014-09-17T08:57:54Z,2014-09-18T03:36:27Z,,,
1194,Add a test for if_modified_since parameter of httpclient.HTTPRequest,2014-09-16T08:42:06Z,2014-09-16T12:37:55Z,,,
1193,Remove unused module in tornado.platform.asyncio and Fix for ticket #1123,2014-09-16T06:45:57Z,2014-09-16T10:57:13Z,,,
1192,Monotime is a C extension which is unsuitable for PyPy,2014-09-15T13:08:10Z,2014-09-21T16:03:20Z,,,
1191,Add a speedups version that uses CFFI,2014-09-15T10:05:48Z,2014-09-15T17:51:26Z,,,
1190,Improved the build matrix.,2014-09-15T09:52:32Z,2015-01-14T14:22:03Z,,,
1189,Add few tests and remove unused module.,2014-09-15T06:57:44Z,2014-09-15T23:38:20Z,,,
1188,curl_httpclient: executing request in streaming callback raises error,2014-09-15T04:52:51Z,2014-09-21T16:45:14Z,httpclient,,
1187,Added a unit test for setting a cookie with expires_days,2014-09-14T14:39:25Z,2014-09-16T02:27:03Z,,,
1186,Added a unit test for setting a cookie with expires_days,2014-09-14T13:49:46Z,2014-09-14T13:58:20Z,,,
1185,Added unit tests for tornado.web.removeslash and tornado.web.addslash,2014-09-14T04:26:57Z,2014-09-14T13:40:26Z,,,
1184,Speed up stack_context.py,2014-09-13T22:05:24Z,,multiple,,
1183,Add callback error handling to Future,2014-09-12T11:53:40Z,2014-09-15T02:40:36Z,,,
1182,Add test for tornado.escape.recursive_unicode,2014-09-12T07:26:32Z,2014-09-12T13:20:54Z,,,
1181,Fix typo,2014-09-11T22:05:58Z,2014-09-12T03:48:00Z,,,
1180,Allow setting query params for HTTPRequest,2014-09-11T18:11:02Z,,httpclient,,
1179,Added a unit test for setting a cookie with max_age,2014-09-11T13:41:42Z,2014-09-13T21:44:55Z,,,
1178,Fixed some typos,2014-09-11T05:41:02Z,2014-09-11T12:51:32Z,,,
1177,AsyncTestCase swallows multiple callback exceptions,2014-09-10T09:28:02Z,2014-09-15T03:53:37Z,,,
1176,Correctly handle invalid cookies,2014-09-06T15:30:26Z,2016-10-01T04:38:28Z,httputil,,
1175,Add documentation warning about exceptions in coroutines,2014-09-05T15:58:33Z,2014-09-15T03:11:24Z,,,
1174,"Tornado 3.2, uncaught StreamClosedError exception",2014-09-05T04:45:29Z,2014-10-12T03:34:37Z,websocket,StreamClosedError,StreamClosedError: Stream is closed
1173,WebSocketHandler close() method should call on_close(),2014-09-05T02:49:17Z,2015-01-19T01:40:36Z,websocket,,
1172,_parse_headers and latin1,2014-09-03T14:16:45Z,2014-09-05T08:20:38Z,,,
1171,Template fail silently,2014-09-03T09:05:01Z,2014-09-04T02:37:39Z,,,
1170,reverse_url can not Create correct Url,2014-09-01T05:45:15Z,2014-09-01T14:25:59Z,,,
1169,I want to use the stream_request_body class decorator for uploading large file. How to use the stream_request_body class decorator?,2014-08-27T13:53:59Z,2014-08-27T14:51:43Z,,,
1168,HTTP client does not handle socket connection errors,2014-08-27T13:12:21Z,2014-09-01T03:48:46Z,,AttributeError,AttributeError: 'NoneType' object has no attribute 'add_done_callback'
1167,Fail silently in template expressions,2014-08-27T11:29:17Z,2014-09-04T02:37:24Z,,,
1166,Add missing argument max_buffer_size to TCPClient.connect in SimpleAsyncHTTPClient,2014-08-26T14:07:15Z,2014-08-27T02:39:50Z,,,
1165,Memory leak,2014-08-26T08:34:41Z,2014-08-30T19:28:03Z,,,
1164,Proxying streamed uploads,2014-08-25T19:25:26Z,2014-08-27T20:50:35Z,,,
1163,Starting and stopping tornado server in thread,2014-08-25T18:50:39Z,2014-09-21T16:27:37Z,,,
1162,Replace tornado.util.bytes_type to bytes,2014-08-25T05:57:30Z,2014-08-26T02:56:38Z,,,
1161,Blocking calls using @gen.coroutine,2014-08-25T05:54:47Z,2014-09-21T16:41:56Z,,,
1160,No child processes IOError with Python 2.7.8 and Tornado 4.0.1,2014-08-24T05:55:50Z,2014-08-24T14:31:35Z,,IOError,IOError: [Errno 10] No child processes
1159,problems via Handler's Pattern & reverse_url,2014-08-24T04:18:11Z,2014-08-24T14:28:23Z,,,
1158,Support yielding asyncio.Future from gen.coroutine,2014-08-23T15:51:36Z,2014-08-23T17:11:08Z,,,
1157,Speedup utf8(),2014-08-23T14:45:01Z,2014-08-27T17:33:41Z,,,
1156,gzip encoding does not work in 4.0,2014-08-23T08:13:52Z,2014-08-23T22:30:35Z,,,
1155,set _running = False at end of IOLoop.start,2014-08-23T01:07:58Z,2014-08-24T15:37:59Z,,,
1154,"Tornado 4.0.1, AsyncHTTPTestCase, IOLoop is already running",2014-08-22T15:02:49Z,,testing,RuntimeError,RuntimeError: IOLoop is already running
1153,Fixed support for test generators,2014-08-22T08:49:10Z,2014-08-23T00:48:15Z,,,
1152,Implement PipeIOStream alternative for Windows.,2014-08-21T21:09:43Z,,"iostream, windows",,
1151,"Write handle list like dict and output a Json,",2014-08-21T00:56:12Z,2014-08-21T13:41:32Z,,,
1150,Support for application/json in parse_body_arguments,2014-08-20T20:02:41Z,2014-08-21T13:42:20Z,,,
1149,normalize the code param of set_default_locale,2014-08-19T09:05:28Z,,locale,,
1148,Addressing race condition in SimpleAsyncHTTPClient's _on_timeout(),2014-08-13T00:30:29Z,2014-08-20T03:01:57Z,,,
1147,Missing return statements in ioloop.call_later and ioloop.call_at,2014-08-12T22:31:33Z,2014-08-19T16:41:00Z,,,
1146,async_sleep function for coroutines,2014-08-12T15:20:20Z,2015-01-19T20:39:37Z,gen,,
1145,torndb Error 2006: MySQL Server has gone away,2014-08-11T04:51:31Z,2014-08-11T13:53:30Z,,,
1144,websocket same-origin policy causing issues on localhost,2014-08-09T22:59:54Z,2014-08-10T20:46:50Z,,,
1143,json_decode return a tornado.util.ObjectDict object,2014-08-09T09:44:03Z,2014-08-10T16:42:49Z,,,
1142,Fix `IOStream' when callback function return `Future' and has `Exception' will silence ignore,2014-08-07T17:56:06Z,2014-08-09T17:40:46Z,,,
1141,Order of Operations issue in constructor to RequestHandler,2014-08-06T23:46:44Z,,web,,
1140,Tornado 4.0 raises AttributeError in WebSocketClientConnection._on_close,2014-08-06T14:16:37Z,2014-08-09T18:26:57Z,,AttributeError,AttributeError: 'WebSocketClientConnection' object has no attribute 'resolver'
1139,Add `application/json` support for request bodies,2014-08-06T12:50:56Z,2014-08-07T01:00:16Z,,,
1138,Fix `PeriodicCallback' when callback function return `Future' and has,2014-08-06T10:38:58Z,2014-08-07T00:54:45Z,,,
1137,Refactored method execution in tornado.web,2014-08-06T02:43:04Z,,web,,
1136,socket.gaierrors for ipv6 tests on OSX 10.6,2014-08-05T07:58:19Z,2014-08-12T12:55:18Z,,socket.gaierror,"socket.gaierror: [Errno 8] nodename nor servname provided, or not known"
1135,"parameter self is useless,instance method could be a static mehod",2014-08-03T05:19:06Z,2014-08-05T02:36:26Z,,,
1134,Exceptions getting swallowed in coroutines,2014-07-29T23:09:15Z,2015-01-17T22:34:57Z,gen,,
1133,stall tearDown in AsyncTestCase with prepare’d WebSocketHandler,2014-07-29T02:44:43Z,2014-08-05T03:48:48Z,,,
1132,Facebook demo has Invalid App ID,2014-07-28T23:36:12Z,2014-08-24T15:51:40Z,,,
1131,"when coroutine in coroutine, why performance is so bad?",2014-07-28T06:55:59Z,2014-08-07T03:34:49Z,,,
1130,Update blog example to use GoogleOAuth2Mixin instead of GoogleMixin,2014-07-27T05:05:06Z,,other,,
1129,Added support to change the default `Content-Type` for json,2014-07-25T14:51:36Z,2014-07-26T11:28:20Z,,,
1128,Cancelable Future from AsyncHTTPClient (for SimpleHTTPClient),2014-07-24T18:20:34Z,2017-06-05T19:36:11Z,httpclient,,
1127,WebSocket connection fail on V4.0,2014-07-24T08:16:27Z,2014-07-24T08:31:15Z,,,
1126,WebSocket disconnects and errors,2014-07-23T18:07:01Z,2014-07-27T17:05:00Z,websocket,,
1125,Fixed a bug with keep-alive chunked requests,2014-07-23T17:28:13Z,2014-07-24T02:27:08Z,,,
1124,Support for non-RFC compliant header prefixes,2014-07-22T16:52:15Z,2014-07-24T02:22:36Z,,,
1123,redirect requests starting with '//' to '/' leading to wrong place,2014-07-21T06:11:08Z,2015-03-10T02:25:50Z,web,,
1122,Unused client_secret parameter in OAuth2Mixin.authorize_redirect,2014-07-19T22:50:09Z,,auth,,
1121,Provide a mechanism to determine if there is an IOLoop on the current thread,2014-07-19T16:07:57Z,,ioloop,,
1120,Typing error,2014-07-18T17:21:46Z,2014-07-19T02:09:11Z,,,
1119,"IOLoop.call_{at,later} don't return handles",2014-07-17T21:47:47Z,2014-07-18T03:49:24Z,,,
1118,getattr in httputil.py,2014-07-17T20:55:46Z,2014-07-18T03:49:24Z,,AttributeError,AttributeError: 'NoneType' object has no attribute 'remote_ip'
1117,Coroutines hangs on exceptions when using ThreadPoolExecutor.,2014-07-17T14:25:00Z,2014-07-17T14:32:17Z,,,
1116,make IOCMD_RESTARTREAD available for PUT requests,2014-07-16T13:51:17Z,2014-07-17T00:16:38Z,,CurlError,CurlError: HTTP 599: necessary data rewind wasn't possible
1115,v4 cannot be easily installed on Windows,2014-07-16T08:12:04Z,2014-07-17T00:25:36Z,,,
1114,tornado.httpserver.HTTPConnection is gone,2014-07-15T23:04:22Z,2014-07-16T02:39:42Z,,,
1113,added local install (using the sphinx-build),2014-07-15T17:20:45Z,2014-07-15T17:38:21Z,,,
1112,doc error,2014-07-15T17:06:57Z,2014-07-16T02:48:00Z,,,
1111,Pycurl violates RFC 2616/10.3.2 and switch from POST to GET,2014-07-15T15:58:59Z,,httpclient,,
1110,Don't use BytesIO to make interface of read-only data file-like,2014-07-15T12:39:25Z,,multiple,,
1109,"Removed dead ""io.BytesIO vs cStringIO.StringIO"" code",2014-07-15T10:53:36Z,2014-07-16T02:54:16Z,,,
1108,pypi dont host beta?,2014-07-13T04:29:11Z,2014-07-13T04:39:20Z,,,
1107,Properly restore ASYNC_TEST_TIMEOUT after test.,2014-07-12T18:25:20Z,2014-07-13T02:40:32Z,,,
1106,Bugfix in asynchronous_fetch example code.,2014-07-11T17:05:24Z,2014-07-13T02:39:31Z,,,
1105,Complete the Motor example.,2014-07-11T17:03:24Z,2014-07-13T02:39:15Z,,,
1104,NPE in iostream.py,2014-07-11T12:39:08Z,2015-01-24T22:47:25Z,iostream,TypeError,TypeError: object of type 'NoneType' has no len()
1103,KeyError in ioloop.py,2014-07-11T12:31:09Z,2015-01-24T22:47:32Z,ioloop,KeyError,KeyError: 8
1102,Fixes bug disallowing custom-made reason phrase,2014-07-10T13:48:17Z,2014-07-16T04:06:54Z,,,
1101,typo,2014-07-10T09:17:39Z,2014-07-10T18:24:30Z,,,
1100,How to add iframe code?,2014-07-10T05:26:46Z,2014-07-13T01:30:13Z,,,
1099,web.authenticated: allow 403 without redirection,2014-07-09T18:13:07Z,,web,,
1098,Small change on WSGIContainer.__call__ to allow environ method overriding in subclasses.,2014-07-07T15:33:59Z,,wsgi,,
1097,Handle bogus values passed to `_xsrf`,2014-07-07T12:16:39Z,2014-07-09T02:41:30Z,,,
1096,Invalid XSRF cookie value throws TypeError,2014-07-07T11:09:11Z,2014-07-09T02:54:16Z,,TypeError,TypeError: object of type 'NoneType' has no len()
1095,Provide control over gzip compression level in tornado.web.Application,2014-07-03T21:43:04Z,,web,,
1094,HTTPHeaders.get_list() improve functionality,2014-07-03T13:39:13Z,,httpserver,,
1093,Write curl_httpclient logs to a separate logger,2014-07-03T08:34:19Z,2015-01-24T22:16:02Z,log,,
1092,Update web.py to implements default method head(),2014-07-03T05:30:53Z,2014-07-03T15:12:21Z,,,
1091,Fix binary websocket connections,2014-07-02T21:16:28Z,2014-07-03T01:37:11Z,,UnboundLocalError,UnboundLocalError: local variable 'decoded' referenced before assignment
1090,Improve curl_httpclient so it supports custom methods with payload.,2014-07-01T17:56:53Z,2014-07-25T03:38:00Z,httpclient,,
1089,Fix for ticket #1036: Add proxy-style (absolute-url) requests support,2014-06-26T12:33:31Z,2015-03-26T02:01:56Z,httpserver,,
1088,Add functions to parse response from Google OAuth2,2014-06-26T04:32:38Z,,auth,,
1087,RequestHandler.send_error strips custom HTTP headers,2014-06-25T20:35:19Z,2014-06-26T02:13:43Z,,,
1086,Make options.parse_config_file supporting custom encoding,2014-06-25T08:15:07Z,2014-07-16T04:19:10Z,,,
1085,disable exception raising behavior,2014-06-23T18:24:06Z,2014-06-26T18:35:53Z,,,
1084,check for errno.WSA* on 64-bit Windows (fixes #1052),2014-06-23T12:52:38Z,2014-06-26T02:00:35Z,,IndexError,IndexError: pop from an empty deque
1083,Rendering template with compress_whitespace does not remove empty lines,2014-06-21T04:07:11Z,2015-07-05T22:44:29Z,template,,
1082,Empty reply on malformed HTTP request,2014-06-20T11:21:24Z,2017-06-10T21:18:43Z,httpserver,,
1081,Truely coroutine based Chat Demo,2014-06-19T17:37:33Z,2014-06-20T03:16:20Z,,,
1080,Issue Labels,2014-06-17T00:56:25Z,2014-07-16T04:57:56Z,,,
1079,Potential memory leak in ioloop and httpclient module.,2014-06-16T12:41:55Z,2014-06-17T14:27:30Z,,,
1078,very basic proxy support,2014-06-13T22:39:48Z,2014-06-17T21:44:52Z,,,
1077,StaticFileHandler path for .apk and. ipa file extension download problems？,2014-06-12T14:37:30Z,2014-06-13T00:55:01Z,,,
1076,translate :34,2014-06-10T15:33:29Z,2014-06-15T14:52:32Z,,,
1075,WSGIContainer in Executor,2014-06-07T10:45:12Z,,wsgi,,
1074,pip install fails for OSX machine with no compiler,2014-06-06T22:04:31Z,2014-06-07T16:16:18Z,,SystemError,SystemError: Cannot locate working compiler
1073,max_age parameter not used when computing far-future cookie in decode_signed_value,2014-06-06T18:00:25Z,2014-06-13T03:07:51Z,,,
1072,"Help In php $ _SERVER ['HTTP_HOST'], tornado how to get?",2014-06-06T13:43:09Z,2014-06-06T13:44:21Z,,,
1071,add headers property to HTTPError,2014-06-05T11:39:47Z,2014-06-19T21:01:53Z,,,
1070,Websocket connection closes exactly after one minute,2014-06-05T10:11:21Z,2014-06-05T11:58:51Z,,,
1069,ioloop.py: use itertools.count() as tiebreaker to preserve FIFO in case of tie,2014-06-03T20:15:53Z,2014-06-03T23:49:41Z,,,
1068,"From #1067, updated Google Auth docs to reflect API changes",2014-05-28T18:53:58Z,2014-06-01T17:22:09Z,,,
1067,Google OAuth Changes,2014-05-27T23:23:05Z,2014-06-01T17:22:16Z,,,
1066,Add debug-mode flag for translation files,2014-05-26T02:40:38Z,,locale,,
1065,Relax restrictions on WebSocketHandler methods,2014-05-25T00:58:16Z,2014-06-16T04:09:36Z,,,
1064,"""Stop"" exception in RequestHandler",2014-05-25T00:52:43Z,2014-06-19T13:52:08Z,,,
1063,Stack-context-local variable pattern,2014-05-25T00:40:22Z,,stack_context,,
1062,PyPi Index Broken HTTP 404,2014-05-19T14:52:08Z,2014-05-22T01:48:51Z,,,
1061,Extended gen_test decorator to pass args and kwargs.,2014-05-16T23:04:35Z,2014-05-17T14:04:02Z,,,
1060,log.py: enable_pretty_logging() is now idempotent,2014-05-16T15:27:01Z,,log,,
1059,Google App Engine demo can't import fcntl when deployed to GAE,2014-05-15T10:33:47Z,2014-05-17T14:58:37Z,,ImportError,ImportError: No module named fcntl
1058,Changes in master branch gen module break code previously working,2014-05-14T19:15:28Z,2014-05-19T04:04:13Z,,,
1057,Duplicate payload in some websocket packets,2014-05-13T16:03:35Z,2014-05-13T16:09:52Z,,,
1056,The latest chatdemo.py doesn't work,2014-05-12T18:30:00Z,2014-05-23T19:17:07Z,,AttributeError,AttributeError: 'module' object has no attribute 'coroutine'
1055,Test Python 3.4 on Travis.,2014-05-12T08:00:44Z,2014-05-12T18:49:58Z,,,
1054,Fixed websocket test.,2014-05-12T07:55:24Z,2014-05-19T01:58:54Z,,HTTPError,HTTPError: HTTP 599: Timeout
1053,Add support for custom reasons to curl_httpclient,2014-05-12T03:50:22Z,2014-05-20T02:12:26Z,,,
1052,Windows doesn't use standard error numbers: suggested quick fix,2014-05-11T19:03:23Z,2014-06-26T02:00:38Z,,,
1051,Fix for ticket #904 - Addition of get_claimed_ip() to HTTPRequest,2014-05-10T19:26:46Z,,httpserver,,
1050,get_ssl_certificate is untested,2014-05-10T17:06:33Z,,httpserver,,
1049,Improve API for timeouts,2014-05-09T12:55:46Z,2014-06-18T14:31:12Z,,,
1048,Strange exceptions propagation with coroutines,2014-05-07T16:14:51Z,2014-07-19T23:16:56Z,gen,Exception,Exception: Error in A
1047,websocket miss upgrade,2014-05-07T09:38:04Z,2014-05-07T13:15:17Z,,,
1046,Unexplained latency when serving large files (1GB+),2014-05-06T22:48:50Z,2014-05-08T01:39:07Z,,,
1045,Fixed tests on Windows.,2014-05-06T09:36:22Z,2014-05-06T12:57:18Z,,"AssertionError, ValueError","AssertionError: 1696 is not 1696, ValueError: preexec_fn is not supported on Windows platforms"
1044,Use constant for blocking errnos.,2014-05-06T09:26:15Z,2014-05-06T12:55:34Z,,,
1043,Security Contact,2014-05-04T21:12:01Z,2014-05-04T21:19:45Z,,,
1042,Changed _on_close method tornado/simple_httpclient.py to raise the error instead of raising an HTTPError,2014-05-04T18:41:17Z,2014-05-09T00:54:43Z,,,
1041,Improve asyncio integration,2014-05-02T13:36:15Z,2015-01-19T20:05:53Z,asyncio,,
1040,nginx sample file change,2014-04-30T22:36:18Z,2014-05-03T13:22:31Z,,,
1039,"""yield None"" fails in Tornado 3.2, works fine in 3.1.1",2014-04-22T01:45:17Z,2014-04-23T01:45:18Z,,,
1038,run_sync leaking file descriptors,2014-04-18T17:02:16Z,2014-04-18T23:16:44Z,,,
1037,Update overview.rst with typos in nginx conf.,2014-04-16T09:07:41Z,2014-04-16T13:27:14Z,,,
1036,Parse proxy-style (absolute-url) requests,2014-04-15T01:38:48Z,,httpserver,,
1035,Update simple_httpclient.py ticket 1033,2014-04-14T16:10:09Z,2014-05-04T18:36:50Z,,,
1034,Delete description for cookie capacity,2014-04-13T13:16:09Z,2014-04-13T15:22:56Z,,,
1033,simple_httpclient _on_close handler loses error information,2014-04-10T02:14:12Z,2014-05-09T00:56:22Z,,,
1032,Add start_time to httpclient and curl_httpclient to better indicate timing reference,2014-04-09T21:42:51Z,,httpclient,,
1031,Add session support,2014-04-09T14:26:08Z,2014-04-16T02:25:56Z,,,
1030,Add SystemError to errors from compilation,2014-04-08T18:24:29Z,2014-04-09T01:13:23Z,,,
1029,fixed broken reference link,2014-04-08T17:55:27Z,2014-04-09T01:12:13Z,,,
1028,A typo,2014-04-08T07:43:13Z,2014-04-08T12:04:39Z,,,
1027,Correct function that converts object to unicode string or string encoded as utf8,2014-04-08T07:09:27Z,,template,UnicodeEncodeError,UnicodeEncodeError: 'ascii' codec can't encode characters in position 0-1: ordinal not in range(128)
1026,tornado file upload problem in higher dimensions,2014-04-02T13:38:40Z,2014-04-02T22:36:03Z,,,
1025,Add an option for maximum header size considered safe,2014-03-28T15:02:58Z,2015-07-30T02:54:32Z,web,,
1024,Tornado web server sometimes did not manage the request,2014-03-28T02:02:28Z,2014-04-28T03:16:05Z,,,
1023,put assertion outside of the exception handler,2014-03-27T00:52:54Z,2014-03-31T14:54:16Z,,,
1022,tab to space,2014-03-26T01:04:22Z,2014-03-26T01:56:02Z,,,
1021,Major HTTP refactoring for streaming uploads,2014-03-24T02:59:37Z,2014-04-27T18:14:15Z,,,
1020,Fix a mistake in template document.,2014-03-24T01:23:26Z,2014-03-24T01:28:30Z,,,
1019,add IOLoop.clear_instance,2014-03-21T18:02:12Z,2014-03-22T17:20:06Z,,,
1018,Speedups fail to build due to warnings treated as errors on Python 3.4.0,2014-03-18T06:57:10Z,2014-03-18T14:02:24Z,,,
1017,fix timeouts less than 1 sec when libcurl is compiled without c-ares,2014-03-16T17:57:53Z,2014-04-28T03:15:20Z,,,
1016,follow pep8: Don't compare boolean values to True or False using ==.,2014-03-16T14:52:16Z,2014-03-16T15:52:16Z,,No,No:    if greeting == True:
