ID,Title,Created At,Closed At,Issues,Errors,Messages
1758,No trigger of on_message for long messages,2016-06-29T17:40:58Z,2016-07-15T01:20:03Z,,,
1757,TimeoutError: [Errno 60] Operation timed out,2016-06-27T18:35:43Z,2016-07-15T01:19:36Z,,TimeoutError,TimeoutError: [Errno 60] Operation timed out
1756,Mocks for async tornado functions,2016-06-27T08:34:55Z,,testing,,
1755,tornado process stay in _GzipMessageDelegate.data_received() forever,2016-06-23T11:22:46Z,,,,
1754,Is it possible to pass couple of modules to all template?,2016-06-18T09:11:20Z,2016-06-19T15:04:32Z,,,
1753,request_timeout does not stop HTTP 599: Timeout,2016-06-17T13:30:24Z,,,,
1752,Fail early if a v1 cookie is submitted to a service configured with v2,2016-06-15T07:39:35Z,,web,,
1751,tornado raise value error when setting status code 422 though it is in httplib.responses,2016-06-13T09:48:36Z,2016-06-13T13:48:44Z,,ValueError,"ValueError: ('unknown status code %d', 422)"
1750,test: Silence PendingDeprecationWarning on nightly,2016-06-12T20:29:08Z,2016-06-12T22:40:11Z,,,
1749,"Add built-in security features, such as rate limiting, XSS protection and more",2016-06-12T10:43:16Z,2016-06-12T19:47:38Z,,,
1748,add shebang,2016-06-11T04:06:06Z,2016-06-12T19:48:55Z,,,
1747,Fix pycurl UnicodeEncodeError,2016-06-10T17:37:58Z,2016-08-13T07:39:50Z,,UnicodeEncodeError,UnicodeEncodeError: 'ascii' codec can't encode characters in position 36-37: ordinal not in range(128)
1746,add __slots__ fro HTTPHeaders,2016-06-08T16:55:20Z,2016-06-12T22:57:34Z,,,
1745,should add __slots__ for HTTPHeaders,2016-06-08T16:51:30Z,2016-06-12T22:57:55Z,,,
1744,line too long,2016-06-08T14:48:32Z,2016-06-12T19:26:27Z,,,
1743,Allow 204 responses without Content-Length/Transfer-Encoding,2016-06-08T01:49:07Z,2016-07-01T16:06:39Z,,,
1742,Add __slots__ for HTTPHeaders,2016-06-07T17:08:36Z,2016-06-08T16:50:20Z,,,
1741,Fix SVG file recognition on StaticFileHandler,2016-06-06T04:50:26Z,2016-06-12T18:21:23Z,,,
1740,websocket on local host works only if connected to the web,2016-06-04T05:24:30Z,2016-06-12T18:11:34Z,,,
1739,Static method for determining if an IOLoop is installed and running,2016-06-03T17:42:12Z,2016-06-16T01:27:41Z,,,
1738,tornado responds 301 for GET requests when no handlers are configured,2016-06-03T03:52:18Z,2017-03-26T16:11:47Z,,,
1737,Using Tornado as a REST server cannot return 304,2016-06-03T00:49:30Z,2016-06-03T20:55:57Z,,,
1736,Could/should a 204 response omit the Content-Length header?,2016-06-02T20:21:26Z,2016-07-12T11:52:22Z,,,
1735,Add an optional script to install mypy,2016-05-30T22:44:55Z,,other,,
1734,build failure on ubuntu/armhf buildd (test failure),2016-05-30T20:52:58Z,2016-08-05T06:19:13Z,,,
1733,Add mypy to Travis build,2016-05-30T01:27:40Z,2016-06-04T22:12:03Z,,,
1732,Add small script to type-check the code,2016-05-30T00:51:44Z,2016-06-04T22:11:50Z,,,
1731,Convert readthedocs link for their .org -> .io migration for hosted projects,2016-05-29T14:04:43Z,2016-06-04T22:12:26Z,,,
1730,Working with invalid cookies,2016-05-26T20:50:00Z,2016-05-28T18:00:09Z,,,
1729,_Timeout.__lt__ speedup,2016-05-25T22:18:20Z,2016-05-28T17:01:38Z,,,
1728,Add hint about installing AsyncIOMainLoop early,2016-05-25T17:58:15Z,2016-06-04T22:13:31Z,,,
1727,better format for process.py,2016-05-25T09:29:52Z,2016-05-28T17:29:56Z,,,
1726,"Trivial patch to handle undefined ""sockets"" local variable",2016-05-24T11:58:45Z,2016-05-28T16:43:10Z,,,
1725,Fix testsuite failure when sockets is not defined,2016-05-24T10:30:01Z,2016-05-28T16:43:01Z,,"""UnboundLocalError","""UnboundLocalError: local variable 'sockets' referenced before assignment"""
1724,windows SSL certificate problem: unable to get local issuer certificate,2016-05-24T05:48:00Z,2016-05-24T05:56:45Z,,,
1723,Discuss about  _NormalizedHeaderCache,2016-05-23T09:21:53Z,2016-05-30T07:36:23Z,,,
1722,Fix error raised in set_close_exec on windows,2016-05-22T01:33:40Z,2016-05-22T01:55:21Z,,,
1721,socket.gaierror thrown in ExecutorResolver,2016-05-17T16:41:38Z,2016-06-12T19:09:17Z,,,
1720,Fixed #1718,2016-05-15T14:10:25Z,2016-05-28T16:08:27Z,,,
1719,"py35 error with ""bytes-like object is required, not 'str' """,2016-05-12T05:20:03Z,2016-05-21T21:54:49Z,,TypeError,"TypeError: a bytes-like object is required, not 'str'"
1718,Incorrect response for invalid Content-Length header,2016-05-10T11:26:27Z,2016-05-28T16:08:27Z,,ValueError,ValueError: invalid literal for int() with base 10: '\x8d\x00\x00\x00'
1717,Question about handling blocking code in periodiccallback,2016-05-09T17:10:30Z,2016-05-13T01:23:37Z,,,
1716,gen: handle None in convert_yielded,2016-05-09T11:09:14Z,2017-03-26T15:46:00Z,,,
1715,a high leve protocal parser,2016-05-08T14:53:27Z,2016-05-21T23:10:03Z,,,
1714,Update options to have same behavior from config file or command line,2016-05-05T11:36:10Z,,options,,
1713,use the alias of self.application.settings,2016-05-05T08:40:30Z,2016-06-02T02:09:37Z,,,
1712,Don't require backports.ssl_match_hostname on Python 2.7.9 and newer,2016-05-04T07:36:43Z,2016-05-21T23:44:54Z,,,
1711,add str and repr method of HTTPHeader,2016-05-04T03:00:49Z,2016-06-16T01:43:51Z,,,
1710,fix `replace_callback` argument that is not used,2016-05-04T02:23:31Z,2016-05-21T23:50:59Z,,,
1709,Update index.html,2016-05-03T08:27:58Z,2016-05-27T09:21:40Z,,,
1708,HTTPClient command line interface does not print headers,2016-05-03T08:26:48Z,2018-01-07T02:25:46Z,,,
1707,find an interesting thing,2016-05-02T15:42:47Z,2016-05-04T10:47:23Z,,"ImportError, except","ImportError: No module named 'Cookie', except:"
1706,Custom encoder for JSON,2016-05-01T23:43:17Z,2016-05-13T00:42:58Z,,,
1705,Update options.py in order to have same behavior when tornado read op…,2016-04-30T20:44:57Z,2016-05-05T11:26:51Z,,,
1704,Add shebang for webspider.py,2016-04-30T00:30:50Z,2016-04-30T15:50:24Z,,,
1703,raise ctypes.GetLastError on windows raise another Exception,2016-04-28T20:15:04Z,2016-05-22T01:55:27Z,,TypeError,"TypeError: exceptions must be old-style classes or derived from BaseException, not int"
1702,how to set time out without disconnecting?,2016-04-28T09:15:58Z,2016-04-29T04:07:05Z,,,
1701,how to write to iostream before read_until finishs?,2016-04-27T16:23:35Z,2016-04-29T02:48:39Z,,,
1700,Cannot stop Application/HTTPServer/RequestHandler,2016-04-25T15:09:53Z,,,,
1699,Begin to fix type confusion in HTTPHeaders.,2016-04-23T23:40:24Z,2016-04-24T00:11:54Z,,,
1698,Add method to define additional HTTP headers for websocket handshake response,2016-04-21T16:30:27Z,2017-11-14T12:29:27Z,websocket,,
1697,Custom StaticFileHandler,2016-04-20T21:40:50Z,2016-04-23T18:31:32Z,,,
1696,recommended usage of AsyncIOMainLoop throws assertion,2016-04-20T12:29:43Z,2016-04-20T13:57:03Z,,,
1695,Logging suppress,2016-04-20T01:17:57Z,2016-04-21T10:24:05Z,,,
1694,options.parse_config_file also enable tornado.log.LogFormatter,2016-04-19T05:47:03Z,2016-04-20T02:37:15Z,,,
1693,get_template_namespace throws exception after request finish(),2016-04-18T15:29:34Z,2016-04-21T14:21:10Z,,,
1692,wrong xsrf format cause check_xsrf_cookie throw Uncaught Exception,2016-04-16T07:28:32Z,2016-04-24T18:39:22Z,,TypeError,TypeError: object of type 'NoneType' has no len()
1691,[WIP] Avoid Copies in IOStream.write,2016-04-14T19:43:53Z,2017-02-21T03:28:27Z,,,
1690,Hardcode CSS mimetype for StaticFileHandler?,2016-04-14T14:10:45Z,2016-04-15T11:46:16Z,,,
1689,Avoid uncaught exception when _xsrf argument could not be decoded,2016-04-13T10:19:51Z,2016-04-24T18:39:10Z,,,
1688,`await` with `ThreadPoolExecutor` is awkward,2016-04-10T16:07:01Z,,,,
1687,Unable to add handlers to the same host_pattern after app init,2016-04-08T22:43:45Z,,,,
1686,Loading html.entities lazily to reduce memory usage?,2016-04-08T14:52:51Z,2016-04-09T19:51:48Z,,,
1685,Suboptimal performance sending large messages,2016-04-07T03:02:54Z,2017-02-21T03:28:09Z,,,
1684,Using asyncio.gather switch back to the asyncio runner,2016-04-06T10:57:18Z,,,,
1683,Make StaticFileHandler HEAD requests a coroutine,2016-04-05T22:05:27Z,2016-04-06T17:58:51Z,,,
1682,"Update concurrent.py for proper callbacks processing in class Future, method _set_done()",2016-04-05T09:45:13Z,2016-04-06T02:23:26Z,,,
1681,"Now I have a project developed by tornado, can I run it with gunicorn without change my code or change a little？if so, how? ",2016-04-03T08:59:01Z,2016-04-03T13:13:05Z,,,
1680,Strange dependency issue,2016-04-01T16:42:47Z,2016-04-02T01:46:38Z,,,
1679,tornado.process.fork_process served confused,2016-04-01T03:34:07Z,2016-04-01T13:11:45Z,,,
1678,Modify an inappropriate comments for tornado.httpclient.AsyncHTTPClient,2016-03-31T15:38:19Z,2016-03-31T20:57:26Z,,,
1677,Added missing % to format a string.,2016-03-31T12:00:19Z,2016-03-31T12:27:40Z,,,
1676,A small problem about code comments.,2016-03-29T11:57:55Z,2016-03-31T20:57:41Z,,,
1675,Initialization in tornado + sqlalchemy,2016-03-27T16:28:02Z,2016-04-03T18:59:42Z,,,
1674,Updated Facebook permissions,2016-03-25T14:08:21Z,2016-03-25T16:13:36Z,,,
1673,Why can't I access URL parameters from the prepare() method?,2016-03-25T12:13:29Z,2016-03-25T14:13:05Z,,,
1672,SSL issues on Tornado 4.3.0,2016-03-23T05:52:04Z,2016-04-03T19:00:06Z,,,
1671,How to achieve the server side jump,2016-03-22T03:15:33Z,2016-03-22T13:14:12Z,,,
1670,When Use AsyncHttpClien.AttributeError: 'GZipContentEncoding' object has no attribute '_gzip_file',2016-03-21T16:08:12Z,2016-04-24T00:11:54Z,,,
1669,os.fork() not supported on windows,2016-03-21T14:02:24Z,2016-03-22T13:11:37Z,,AttributeError,AttributeError: 'module' object has no attribute 'fork'
1668,"Tornado Stream is closed, cannot see the output message",2016-03-21T11:06:47Z,2016-03-22T13:11:54Z,,IOError,IOError: Stream is closed
1667,Error when yielding from concurrent.futures.Future ,2016-03-18T15:46:25Z,2016-03-22T15:37:29Z,,AttributeError,AttributeError: 'NoneType' object has no attribute 'append'
1666,unable to use __file__ to get the project base_dir from the tornado.options.parse_config_file.,2016-03-18T06:54:41Z,2016-04-03T20:46:28Z,,NameError,NameError: name '__file__' is not defined
1665,AsyncHTTPTestCase's fetch swallows httpclient exception,2016-03-15T15:54:21Z,,,"AssertionError, AttributeError, ValueError","AssertionError: b'spam' != None, AttributeError: 'Future' object has no attribute 'body', ValueError: Body must not be None for method POST (unless allow_nonstandard_methods is true)"
1664,fixed broken link (anchor),2016-03-13T17:00:47Z,2016-03-13T17:11:05Z,,,
1663,ApacheBench | AttributeError: 'NoneType' object has no attribute 'decode',2016-03-13T16:33:48Z,2016-03-13T18:27:02Z,,,
1662,Verifying Facebook Graph API Calls,2016-03-11T13:31:01Z,2016-03-13T03:38:52Z,,,
1661,Verifying Facebook Graph API Calls,2016-03-11T13:12:06Z,2016-03-11T13:21:23Z,,,
1660,Python 64-bit crashes when using `tornado` `CurlAsyncHTTPClient` on Windows,2016-03-10T18:24:18Z,2016-03-22T13:16:14Z,,,
1659,Calling `Future._set_done` twice causes `TypeError`,2016-03-06T20:00:58Z,2016-03-06T23:12:38Z,,,
1658,Add handling of external log rotation,2016-03-05T17:04:32Z,,log,,
1657,fix tornado/web.py #L1075 current_user docstring example,2016-03-03T14:59:44Z,2016-03-04T02:14:51Z,,,
1656,current_user's docstring example has unexpected indent,2016-03-03T14:58:43Z,2016-03-04T02:14:51Z,,,
1655,Bokeh + Tornado not working on Raspberry pi,2016-02-29T18:28:13Z,2016-04-03T20:27:29Z,,IOError,"IOError: Cannot push session document because we failed to connect to the server (to start the server, try the 'bokeh serve' command)"
1654,Split code into folders and files,2016-02-27T00:55:28Z,2016-03-01T03:18:39Z,,,
1653,Moved the rendering of CSS and JS assets to their own instance methods,2016-02-26T15:49:31Z,2017-02-21T03:01:22Z,,,
1652,Should the final rendering of JS and CSS assets be done through UI modules?,2016-02-25T15:16:24Z,2017-02-21T03:01:43Z,,,
1651,PeriodicCallback docs or behavior incorrect,2016-02-24T19:38:33Z,2016-02-25T01:42:52Z,,,
1650,WebSocketHandler.on_message should allow coroutines,2016-02-23T12:43:25Z,2017-02-26T16:44:55Z,,,
1649,docs: give more hints on why windows is unsupported,2016-02-22T16:47:30Z,2017-02-21T02:44:22Z,,,
1648,render() should raise an error when finish() already called,2016-02-22T08:03:33Z,2016-04-09T20:50:48Z,,,
1647,Add a test for HTTPError.__str__ when it uses httputils.,2016-02-19T19:01:17Z,2016-02-22T03:13:15Z,,,
1646,Are you the author of this project? http://ip-json.rhcloud.com/,2016-02-19T07:17:36Z,2016-02-21T23:15:28Z,,,
1645,HEAD requests don't write the body but still add Content-Length,2016-02-18T16:42:51Z,2016-02-18T16:48:31Z,,,
1644,SSLError: [SSL: TLSV1_ALERT_UNKNOWN_CA] tlsv1 alert unknown ca (_ssl.c:1750),2016-02-17T16:28:20Z,2016-02-18T04:48:35Z,,"SSLError, StreamClosedError","SSLError: [SSL: TLSV1_ALERT_UNKNOWN_CA] tlsv1 alert unknown ca (_ssl.c:581), StreamClosedError: Stream is closed"
1643,How to realize  async?,2016-02-17T02:41:06Z,2016-02-17T03:03:10Z,,,
1642,Integrate websocket periodic pinging code from Jupyter,2016-02-15T14:41:39Z,2017-02-25T22:35:23Z,websocket,,
1641,Workaround conflict between new certifi and old openssl.,2016-02-14T20:17:58Z,,netutil,,
1640,Option to periodicaly ping idle websockets to keep proxies happy,2016-02-12T18:15:38Z,2017-02-25T22:35:23Z,,,
1639,"[fea] Ability to inheritance the ""execute"" method",2016-02-11T20:45:29Z,2017-02-20T23:31:47Z,,,
1638,`reverse_url` doesn't escape metacharacters at url endings,2016-02-10T11:24:01Z,2016-02-12T14:59:04Z,,,
1637,Add SVG to compressible mime types,2016-02-06T14:15:30Z,2016-02-08T01:21:45Z,,,
1636,Add support for static extensionless files.,2016-02-06T03:06:20Z,2016-02-08T04:06:29Z,,,
1635,WebSocketHandler.get is not passed *args and **kwargs,2016-02-03T07:47:22Z,2016-02-08T04:04:27Z,,,
1634,Add some prompt when client opening and closing,2016-02-03T02:45:55Z,2016-08-02T11:30:51Z,,,
1633,Is this project active?,2016-01-30T07:19:53Z,2016-01-30T16:11:00Z,,,
1632,There might be performance improvement if we avoid unnecessary join operation in tornado.web.RequestHandler.flush method,2016-01-27T13:51:53Z,2016-01-29T05:27:20Z,,,
1631,Changes to tornado.template in 4.3 breaks external libraries that depend on it,2016-01-26T15:00:50Z,2016-02-14T00:41:18Z,,,
1630,tornado.process.Subprocess.stdout.read_until does not work in python 3 (excepted bytes instead of str),2016-01-21T08:10:17Z,2016-01-21T14:33:45Z,,tornado.iostream.StreamClosedError,tornado.iostream.StreamClosedError: Stream is closed
1629,Fixed a word,2016-01-21T01:26:39Z,2016-02-14T00:12:13Z,,,
1628,Add ability to pass max_restarts into process.fork_processes call in …,2016-01-16T18:27:45Z,,process,,
1627,spec.regex.match could not match URL,2016-01-14T19:31:14Z,2016-01-17T11:14:58Z,,,
1626,Update web.py,2016-01-14T05:47:06Z,2016-01-15T09:32:52Z,,,
1625,separate locale directory [Question],2016-01-09T17:04:57Z,2016-01-11T21:49:15Z,,,
1624,httpclient.HTTPResponse creates cyclical reference,2016-01-08T01:54:51Z,2016-02-14T02:16:16Z,,,
1623,Recommendation: Let the time events to be processed ASAP ,2016-01-07T10:22:10Z,2016-01-29T04:05:44Z,,,
1622,add simple_httpclient connection pool support,2016-01-06T15:48:53Z,,httpclient,,
1621,Update hints for popular operating systems.,2015-12-29T22:17:09Z,2015-12-31T22:56:58Z,,,
1620,delete blanks in the end of a line.,2015-12-28T13:10:11Z,2015-12-31T17:23:12Z,,,
1619,reverse_url should unescape regex string,2015-12-28T06:11:30Z,2016-02-14T02:43:14Z,,,
1618,Make StackContext threadsafe,2015-12-27T14:21:02Z,,stack_context,,
1617,Update web.py,2015-12-27T09:10:53Z,2015-12-31T22:38:21Z,,,
1616,how to upload files with AsyncHTTPClient,2015-12-21T08:53:07Z,2016-11-20T09:14:48Z,,,
1615,"Differentiate HTTPError(599, ""Timeout"") raised by SimpleAsyncHTTPClient",2015-12-21T04:12:44Z,2015-12-31T22:34:57Z,,,
1614,"Differentiate HTTPError(599, ""Timeout"") raised by SimpleAsyncHTTPClient",2015-12-19T22:49:58Z,2015-12-21T04:09:43Z,,,
1613,"Differentiate HTTPError(599, ""Timeout"") raised by SimpleAsyncHTTPClient",2015-12-19T22:25:12Z,2015-12-19T22:48:27Z,,,
1612,"Differentiate HTTPError(599, ""Timeout"") raised by SimpleAsyncHTTPClient",2015-12-19T20:22:38Z,2015-12-19T20:28:02Z,,,
1611,"Differentiate HTTPError(599, ""Timeout"") raised by SimpleAsyncHTTPClient",2015-12-19T19:47:04Z,2015-12-19T19:58:25Z,,,
1610,Template support for async for,2015-12-19T04:04:59Z,2015-12-19T19:24:39Z,,,
1609,reverse_url should unescape regex string,2015-12-19T04:04:13Z,2016-02-14T02:43:27Z,,,
1608,Non-ASCII headers are handled incorrectly by CurlAsyncHTTPClient,2015-12-17T09:16:17Z,2016-02-14T19:00:27Z,,UnicodeDecodeError,UnicodeDecodeError: 'utf-8' codec can't decode byte 0xe9 in position 9: invalid continuation byte
1607,"Differentiate HTTPError(599, ""Timeout"")",2015-12-17T03:14:31Z,2016-01-03T13:19:32Z,,,
1606,Escape syntax for comments,2015-12-17T01:44:13Z,2016-02-14T03:31:15Z,,,
1605,how to run the AsyncTestCase?,2015-12-15T03:08:48Z,2015-12-15T04:14:30Z,,,
1604,make kwargs always work in AsyncHTTPClient.fetch(),2015-12-14T11:24:31Z,2015-12-31T18:56:03Z,,,
1603,Django-style kwargs for reverse_url,2015-12-10T00:18:46Z,,web,Notes,Notes: 
1602,pip install tornado not working properly,2015-12-09T16:11:40Z,2015-12-10T03:13:09Z,,,
1601,Tornado should not collapse `Set-Cookie` headers,2015-12-09T06:08:53Z,2015-12-10T03:11:14Z,,,
1600,"Use super() to call super ""__init__()""",2015-12-08T05:42:16Z,2015-12-08T22:34:09Z,,,
1599,Update options.py,2015-12-07T21:36:09Z,2015-12-18T05:04:04Z,,,
1598,HTTP1Connection cannot handle http/1.0 304 response,2015-12-03T10:19:46Z,2016-02-15T00:04:56Z,,,
1597,POST to Django behind Tornado executed twice,2015-12-03T09:29:59Z,2015-12-03T13:05:10Z,,,
1596,Merge pull request #1 from tornadoweb/master,2015-12-02T09:46:36Z,2015-12-02T13:35:16Z,,,
1595,Hanging concurrent.futures Future,2015-11-24T22:02:17Z,,,,
1594,how to learn tornado,2015-11-24T08:37:42Z,2015-11-28T19:59:33Z,,,
1593,"Use super() to call super ""__init__()""",2015-11-24T05:13:00Z,2015-11-24T10:15:47Z,,,
1592,yield future,2015-11-23T08:27:35Z,2015-11-23T09:56:38Z,,,
1591,Add reuse_port flag to TCPServer.bind method,2015-11-22T11:35:30Z,2015-11-23T10:53:44Z,,,
1590,Add debounce decorator,2015-11-21T22:06:05Z,2016-02-15T00:41:54Z,,,
1589,Improve Libraries and Ecosystem,2015-11-21T21:03:33Z,2015-11-23T10:49:00Z,,,
1588,Properly pass replace_callback kwarg; Fixes #1462,2015-11-21T19:53:50Z,2017-12-21T04:18:14Z,gen,,
1587,Missing hint in documentation,2015-11-20T13:03:01Z,2015-11-21T16:33:02Z,,,
1586,Correct version change in Lock docstring,2015-11-20T11:33:10Z,2015-11-20T14:04:29Z,,,
1585,Subprocess wait_for_exit Error on Windows,2015-11-17T04:09:31Z,2016-05-22T01:55:27Z,,,
1584,Allow write to accept bytearrays,2015-11-13T21:11:18Z,2017-09-15T13:39:56Z,escape,,
1583,tornado httpclient fails on graph.facebook.com,2015-11-11T20:24:34Z,2016-02-15T00:47:40Z,,,
1582,CurlAsyncHTTPClient: free_list starvation if setup fails,2015-11-11T12:23:30Z,2015-11-12T01:14:02Z,,,
1581,Vary: Accept-Encoding header for non-compressable content,2015-11-11T10:42:03Z,,,,
1580,HEAD with compress_response is wrong,2015-11-11T07:19:25Z,,,,
1579,Add monotonic as an alternative to Monotime,2015-11-07T06:01:01Z,2015-11-07T22:23:40Z,,,
1578,Streamline travis-ci build.,2015-11-07T01:04:28Z,2015-11-07T02:09:22Z,,,
1577,parse_response_start_line without reason like 'HTTP/1.1 200' ,2015-11-04T15:29:38Z,2015-11-05T01:25:32Z,,,
1576,Override __setitem__ in tornado.options,2015-11-02T23:03:13Z,2015-11-07T00:55:18Z,,,
1575,Update chatdemo.py,2015-11-02T17:22:20Z,2015-11-02T17:29:10Z,,,
1574,Fixes #1573: Grab first localhost socket when more than one localhost interface registered,2015-10-29T23:37:31Z,2015-11-07T00:54:48Z,,,
1573,Tornado test setup fails when localhost has more than one address,2015-10-29T21:59:05Z,2015-11-07T00:54:48Z,,ValueError,ValueError: too many values to unpack
1572,Options should support setitem,2015-10-29T19:19:53Z,2015-11-07T00:55:18Z,options,,
1571,Error handling in StackContext,2015-10-29T17:49:43Z,2015-11-03T19:10:42Z,,,
1570,"gunicorn integration issue: add do_handshake_on_connect, suppress_ragged_eofs to acceptable ssl options",2015-10-28T07:16:18Z,2015-10-30T05:23:49Z,,AssertionError,"AssertionError: {'do_handshake_on_connect': False, 'certfile': '/home/hiro/201510/server.crt', 'suppress_ragged_eofs': True, 'ciphers': 'TLSv1', 'ssl_version': 3, 'cert_reqs': 0, 'ca_certs': None, 'keyfile': '/home/hiro/201510/server.key'}"
1569,Fix #1543 and add hello world example for running on asyncio event loop,2015-10-27T10:11:38Z,,asyncio,,
1568,Cast start_line.code to an integer,2015-10-26T05:24:17Z,2015-11-07T00:55:34Z,,,
1567,Make test_root_static_path more robust.,2015-10-24T13:59:26Z,2015-10-24T14:22:51Z,,,
1566,Invalid Scopes: read_stream error in facebook,2015-10-24T08:24:50Z,,,,
1565,Unit tests fail under python2.7,2015-10-24T04:23:12Z,2015-10-24T14:22:51Z,,AssertionError,AssertionError: 404 != 200
1564,Disable emitting server info header,2015-10-24T04:11:09Z,2016-02-14T03:35:08Z,,,
1563,Check for Content-Length and Transfer-Encoding,2015-10-23T14:33:41Z,2015-10-24T14:32:27Z,,,
1562,multiple process option raises RuntimeException ,2015-10-21T20:18:14Z,2015-10-22T01:43:30Z,,,
1561,Method on AsyncHTTPTestCase to check there are no messages to read,2015-10-21T16:28:15Z,2015-10-22T01:25:55Z,,,
1560,PEP8 fix docs/conf.py:91:1: E122 continuation line missing indentation,2015-10-20T15:30:10Z,2015-10-20T15:58:08Z,,,
1559,Exception in util.py decompress(),2015-10-19T17:41:01Z,2015-10-24T14:32:49Z,,,
1558,Return HTTPServer in Application.listen,2015-10-19T15:25:24Z,2015-10-24T16:00:18Z,,,
1557,Make singledispatch and backports_abc mandatory dependencies.,2015-10-18T20:36:52Z,2015-10-18T21:50:41Z,,,
1556,AsyncHTTPClient#fetch does not work correctly from another thread,2015-10-17T17:00:09Z,2015-10-17T20:04:09Z,,,
1555,Added xsrf_cookie_secure and xsrf_cookie_httponly optional settings,2015-10-17T14:27:23Z,2015-10-24T16:04:30Z,,,
1554,Allow postmortem debugging after exception in websocket handler,2015-10-16T20:57:13Z,2015-10-30T14:00:11Z,,,
1553,Add void to empty function parameter,2015-10-16T11:52:47Z,2015-10-18T13:44:28Z,,,
1552,Can't enable CurlAsyncHTTPClient to use cookies while following redirections,2015-10-15T20:07:59Z,2015-10-15T21:49:05Z,,,
1551,How to serve large HTML Files,2015-10-14T04:11:47Z,2015-10-14T04:13:49Z,,,
1550,Update gen_test for native coroutines.,2015-10-12T17:48:32Z,2015-10-13T21:34:58Z,,,
1549,AttributeError: 'NoneType' object has no attribute 'do_handshake',2015-10-12T09:54:26Z,2015-10-12T11:10:31Z,,,
1548,AttributeError: 'NoneType' object has no attribute 'do_handshake',2015-10-12T09:50:51Z,2015-10-12T10:20:16Z,,,
1547,request handler to return an orderedDict?,2015-10-12T05:26:48Z,2015-10-12T10:32:31Z,,,
1546,Exceptions in list of futures don't propagate immediately,2015-10-09T22:04:03Z,2015-10-11T21:24:45Z,,,
1545,Application url prefix,2015-10-08T02:38:40Z,2015-10-08T03:10:49Z,,,
1544,Add a Gitter chat badge to README.rst,2015-10-07T03:03:59Z,2016-07-13T02:52:05Z,,,
1543,Autoreload with asyncio event loop doesn't work,2015-10-06T13:04:50Z,2017-03-26T15:14:40Z,,RuntimeError,RuntimeError: Cannot close a running event loop 
1542,More polish for native coroutines,2015-10-04T02:47:38Z,2015-10-04T03:13:54Z,,,
1541,Test fixes,2015-10-03T17:07:11Z,2015-10-03T17:59:15Z,,,
1540,Update versions in CI/tox configs.,2015-10-03T15:22:46Z,2015-10-03T15:51:42Z,,,
1539,"Closing websocket serverside, no reason or code given on client-side. ",2015-10-02T11:31:11Z,2015-10-02T15:23:49Z,,,
1538,Removed links to facebook.com.,2015-10-01T19:53:04Z,2015-10-01T20:53:55Z,,,
1537,Removed broken link.,2015-10-01T18:58:14Z,2015-10-01T19:40:16Z,,,
1536,Broken link fix,2015-10-01T07:49:17Z,2015-10-01T14:22:37Z,,,
1535,Broken link,2015-10-01T07:47:27Z,2015-10-01T14:22:53Z,,,
1534,tornado rejects valid SSL certificates,2015-09-30T17:36:42Z,,,ssl.SSLError,ssl.SSLError: [Errno 1] _ssl.c:510: error:14090086:SSL routines:SSL3_GET_SERVER_CERTIFICATE:certificate verify failed
1533,Fix a regression in FacebookGraphMixin in the 4.3 dev series.,2015-09-29T02:40:11Z,2015-09-29T03:10:49Z,,,
1532,FacebookGraphMixin failing,2015-09-29T00:38:08Z,2015-09-29T03:10:49Z,,`TypeError,`TypeError: 'Future' object is not callable`
1531,Perform sanity checks on request.body only if allow_nonstandard_metho…,2015-09-28T22:03:56Z,2015-10-03T13:54:18Z,,,
1530,Change the implement of remove_fragment method,2015-09-28T02:59:54Z,2015-09-28T03:21:23Z,,,
1529,Change the implement of remove_fragment method,2015-09-28T02:30:25Z,2015-09-28T02:36:08Z,,,
1528,Misc updates,2015-09-28T01:11:39Z,2015-09-28T01:35:04Z,,,
1527,Add appveyor.yml for windows CI.,2015-09-27T23:05:49Z,2015-09-28T00:08:12Z,,,
1526,simple_httpclient: Don't call streaming_callback for redirects.,2015-09-27T17:43:48Z,2015-09-28T03:39:34Z,,,
1525,Fix coverage installation for py32.,2015-09-27T15:58:36Z,2015-09-27T16:28:00Z,,,
1524,Update webspider demo support Python 3,2015-09-26T04:26:36Z,2015-09-27T16:29:33Z,,,
1523,Improve tornado.web.Application documentation,2015-09-22T21:53:00Z,2015-09-27T16:49:52Z,,,
1522,Typo in websocket client documentation,2015-09-22T13:34:23Z,2015-09-27T16:38:30Z,,,
1521,Including a page which extends another template raises NotImplementedError,2015-09-22T07:00:04Z,2015-09-24T03:53:07Z,,,
1520,"Tornado logging: ""No handlers could be found for logger ""tornado.application""",2015-09-18T15:50:13Z,2015-09-27T16:56:56Z,,,
1519,https protocol causes connection timeout when not using ssl_options,2015-09-16T19:17:20Z,2015-09-19T04:54:25Z,,,
1518,tornado.httpclient.HTTPClient.fetch() executes callback on contents of redirect response,2015-09-14T17:39:22Z,2015-09-28T03:39:34Z,,,
