commit,author,date,title,faultID,file
04896b0,Eric Wieser,2018-01-10 23:27:35,"BUG: Avoid unintentional promotion to `float`, and do ops in place for speed",10364,numpy/linalg/linalg.py
087619a,Eric Wieser,2018-01-10 23:09:02,BUG: add missing paren and remove quotes from repr of fieldless struct,10366,numpy/core/arrayprint.py
087619a,Eric Wieser,2018-01-10 23:09:02,BUG: add missing paren and remove quotes from repr of fieldless struct,10366,numpy/core/tests/test_arrayprint.py
cb47070,Eric Wieser,2017-12-27 12:57:56,MAINT: Fallback on the default sequence multiplication behavior,9234,numpy/core/tests/test_scalarmath.py
99f605c,Eric Wieser,2017-12-22 15:31:38,BUG: Fix misleading error when coercing to array,7864,numpy/lib/histograms.py
99f605c,Eric Wieser,2017-12-22 15:31:38,BUG: Fix misleading error when coercing to array,7864,numpy/lib/tests/test_histograms.py
4c83762,Eric Wieser,2017-12-17 23:57:06,BUG: Don't reimplement isclose in np.ma,10227,numpy/ma/core.py
4c83762,Eric Wieser,2017-12-17 23:57:06,BUG: Don't reimplement isclose in np.ma,10227,numpy/ma/tests/test_core.py
528c8c8,Eric Wieser,2017-12-07 21:38:17,BUG: linewidth was not respected for arrays other than 1d,10170,numpy/core/arrayprint.py
528c8c8,Eric Wieser,2017-12-07 21:38:17,BUG: linewidth was not respected for arrays other than 1d,10170,numpy/core/tests/test_arrayprint.py
67aa4e7,Eric Wieser,2017-11-27 09:07:40,BUG: Fix crash in repr of 0d timedelta array,10094,numpy/core/arrayprint.py
67aa4e7,Eric Wieser,2017-11-27 09:07:40,BUG: Fix crash in repr of 0d timedelta array,10094,numpy/core/tests/test_arrayprint.py
2f366f1,Thomas Köppe,2017-11-27 17:03:18,BUG: Fix out-of-bounds access when handling 0d ndarrays (#10101),10101
f107d38,Eric Wieser,2017-11-26 23:04:50,BUG: Fix assert_equal on time-like objects,10081,numpy/testing/nose_tools/utils.py
f107d38,Eric Wieser,2017-11-26 23:04:50,BUG: Fix assert_equal on time-like objects,10081,numpy/testing/tests/test_utils.py
eac6056,orbit-stabilizer,2017-11-19 17:02:05,BUG: Have np.ma.dump and np.ma.load close their files (#10055),10045,numpy/ma/core.py
c9fad87,Charles Harris,2017-11-18 08:53:06,DOC: Add copy of deprecated defindex.html template.,9676
2461bc9,Allan Haldane,2017-06-29 15:20:00,ENH: fix 0d array printing using `str` or `formatter`.,1415,numpy/core/arrayprint.py
2461bc9,Allan Haldane,2017-06-29 15:20:00,ENH: fix 0d array printing using `str` or `formatter`.,1415,numpy/core/tests/test_arrayprint.py
e0fb739,Eric Wieser,2017-11-05 01:58:48,BUG: Fix casting from longdouble to long,9964,numpy/core/setup.py
e0fb739,Eric Wieser,2017-11-05 01:58:48,BUG: Fix casting from longdouble to long,9964,numpy/core/tests/test_scalarmath.py
b1837ea,xoviat,2017-11-05 15:06:58,BLD: [core:setup] disable npymath whole program opt on win32 (#9965),9965,numpy/core/setup.py
e66780c,Eric Wieser,2017-11-05 11:16:10,BUG: Allow float64('1e10000') to overflow,9924,numpy/core/tests/test_scalar_ctors.py
68fdc3f,Allan Haldane,2017-10-18 22:54:58,BUG: add.reduce gives wrong results for arrays with funny strides,9876,numpy/core/tests/test_umath.py
5beafdf,Charles Harris,2017-10-19 09:40:01,Merge pull request #9888 from eric-wieser/remove-astype-special-cases,9527
e9c85ba,Erik Bray,2017-10-19 10:42:54,BUG: Allow __array_interface__['shape'] == () (#7994),7994,numpy/core/tests/test_multiarray.py
8948d65,Eric Wieser,2017-10-18 22:23:56,MAINT: Remove workarounds for gh-9527,9527,numpy/linalg/linalg.py
3856a73,Eric Wieser,2017-10-17 20:41:39,BUG: count_nonzero treats empty axis tuples strangely,9728,numpy/core/numeric.py
3856a73,Eric Wieser,2017-10-17 20:41:39,BUG: count_nonzero treats empty axis tuples strangely,9728,numpy/core/tests/test_numeric.py
3cd20ef,Eric Wieser,2017-10-03 00:35:18,BUG: Fix datetime->string conversion,9712,numpy/core/tests/test_datetime.py
80c624e,Stefan Winkler,2017-10-02 19:06:11,BUG: fix stray comma in _array2string,9777,numpy/core/arrayprint.py
80c624e,Stefan Winkler,2017-10-02 19:06:11,BUG: fix stray comma in _array2string,9777,numpy/core/tests/test_multiarray.py
80c624e,Stefan Winkler,2017-10-02 19:06:11,BUG: fix stray comma in _array2string,9777,numpy/ma/tests/test_core.py
31fd25d,Eric Wieser,2017-04-16 22:52:08,MAINT: Removed duplicated code around `ufunc->identity`,8860
dd86461,Eric Wieser,2017-09-28 01:09:28,BUG: Don't ignore mismatching shapes just because the mask is all zeros,4520,numpy/ma/core.py
dd86461,Eric Wieser,2017-09-28 01:09:28,BUG: Don't ignore mismatching shapes just because the mask is all zeros,4520,numpy/ma/tests/test_core.py
f01d1a6,Eric Wieser,2017-09-27 01:37:34,BUG: np.ma.trace gives the wrong result on ND arrays,5560,numpy/core/fromnumeric.py
f01d1a6,Eric Wieser,2017-09-27 01:37:34,BUG: np.ma.trace gives the wrong result on ND arrays,5560,numpy/ma/core.py
f01d1a6,Eric Wieser,2017-09-27 01:37:34,BUG: np.ma.trace gives the wrong result on ND arrays,5560,numpy/ma/tests/test_core.py
50c4ae1,Eric Wieser,2017-09-27 01:12:46,"BUG: can_cast(127, np.int8) is False",5917,numpy/core/tests/test_numeric.py
0f63efa,Allan Haldane,2017-09-07 12:06:41,BUG: remove voidtype-repr recursion in scalartypes.c/arrayprint.py,9345,numpy/core/arrayprint.py
0f63efa,Allan Haldane,2017-09-07 12:06:41,BUG: remove voidtype-repr recursion in scalartypes.c/arrayprint.py,9345,numpy/core/tests/test_arrayprint.py
366b14c,Eric Wieser,2017-09-25 01:12:36,MAINT: Remove hack from gh-7659 for gh-7493,7659,numpy/ma/core.py
8e26a5d,Eric Wieser,2017-09-23 01:24:05,BUG: Errors thrown by 0d arrays in setitem are silenced and replaced,8461,numpy/ma/tests/test_core.py
2c79962,Eric Wieser,2017-09-23 10:12:16,BUG: Fix silent loss of clongdouble precision,8903
89ba7bf,Eric Wieser,2017-09-23 09:40:57,TST: Check if precision is lost in longcomplex,8903,numpy/core/tests/test_multiarray.py
2549adf,Charles Harris,2017-09-18 17:35:07,BUG: Make scalar function elision check writeable.,9679,numpy/core/tests/test_multiarray.py
2801a34,Allan Haldane,2017-06-26 00:51:53,BUG: PyArray_CountNonzero does not check for exceptions,9295,numpy/core/tests/test_numeric.py
bab798d,Eric Wieser,2017-03-24 23:56:07,BUG: Fix pinv on matrix stacks,8826,numpy/linalg/linalg.py
bab798d,Eric Wieser,2017-03-24 23:56:07,BUG: Fix pinv on matrix stacks,8826,numpy/linalg/tests/test_linalg.py
7412b85,Allan Haldane,2015-06-19 18:58:59,"MAINT: improve struct assignment, allow multi fields views",2353,numpy/ma/core.py
cb4d802,Chris Lamb,2017-09-05 20:24:16,Make system_info output reproducible (#9652),9652,numpy/distutils/misc_util.py
18756ad,Kevin Sheppard,2017-08-22 10:43:06,REF: Remove direct access to flatiter types,3144
633b11c,Kevin Sheppard,2017-08-17 13:02:35,BUG: Missing dirichlet input validation,2089,numpy/random/tests/test_random.py
7a05f44,Ralf Gommers,2017-08-15 05:51:56,BUG: fix regression in 1.13.x in distutils.mingw32ccompiler.,8454,numpy/distutils/mingw32ccompiler.py
7554558,David Schaefer,2017-08-13 22:36:38,BUG: MaskedArray._optinfo is discarded by__eq__/__ne__ (#9540),9540,numpy/ma/core.py
7554558,David Schaefer,2017-08-13 22:36:38,BUG: MaskedArray._optinfo is discarded by__eq__/__ne__ (#9540),9540,numpy/ma/tests/test_core.py
e1ccca9,Eric Wieser,2017-07-18 00:20:25,BUG: Keep mask when calling methods on 0d arrays.,9430,numpy/ma/core.py
e1ccca9,Eric Wieser,2017-07-18 00:20:25,BUG: Keep mask when calling methods on 0d arrays.,9430,numpy/ma/tests/test_core.py
351fe97,Eric Wieser,2017-08-06 12:17:32,MAINT: Remove unneeded asfarray,7088,numpy/linalg/linalg.py
44a4b71,Eric Wieser,2017-08-01 18:14:06,BUG: dtypes are ignored and downcast in issubdtype,9480,numpy/core/numerictypes.py
44a4b71,Eric Wieser,2017-08-01 18:14:06,BUG: dtypes are ignored and downcast in issubdtype,9480,numpy/core/tests/test_numerictypes.py
6a119c9,Eric Wieser,2017-08-01 17:39:11,BUG: Be explicit about allowing all integer types in matrix exponentiation,9506,numpy/matrixlib/defmatrix.py
6a119c9,Eric Wieser,2017-08-01 17:39:11,BUG: Be explicit about allowing all integer types in matrix exponentiation,9506,numpy/matrixlib/tests/test_defmatrix.py
18a4a4b,Charles Harris,2017-07-26 20:02:30,BUG: Fix true_divide when dtype=np.float64 specified.,3484,numpy/core/code_generators/generate_umath.py
18a4a4b,Charles Harris,2017-07-26 20:02:30,BUG: Fix true_divide when dtype=np.float64 specified.,3484,numpy/core/tests/test_ufunc.py
8a511c6,Ralf Gommers,2017-07-27 19:25:59,BLD: remove -xhost flag from IntelFCompiler.  Closes gh-9042.,9042,numpy/distutils/fcompiler/intel.py
460cf65,Eric Wieser,2017-07-20 21:16:51,Merge pull request #9412 from mattip/fix-9404,3879
36f481b,Eric Wieser,2017-07-18 15:40:30,BUG: change fix for gh-9328 to make masked.copy() a noop,9328,numpy/ma/core.py
36f481b,Eric Wieser,2017-07-18 15:40:30,BUG: change fix for gh-9328 to make masked.copy() a noop,9328,numpy/ma/tests/test_core.py
f696935,Daniel Hrisca,2017-07-06 18:08:51,BUG: Fix error in fromstring function from numpy.core.records (#9369),9369,numpy/core/records.py
13978dd,Eric Wieser,2017-07-03 08:49:26,MAINT: Use a for loop to traverse the linked list,9351
7844860,Eric Wieser,2017-07-02 22:29:44,BUG: Prevent hangs traversing ufunc userloop linked lists,9351,numpy/core/tests/test_ufunc.py
cd761d8,Eric Wieser,2017-07-01 13:05:15,BUG: recfunctions.join_by fails for colliding values with different dtypes,9338,numpy/lib/recfunctions.py
cd761d8,Eric Wieser,2017-07-01 13:05:15,BUG: recfunctions.join_by fails for colliding values with different dtypes,9338,numpy/lib/tests/test_recfunctions.py
4ff8d0a,Eric Wieser,2017-06-30 22:29:25,BUG: Prevent copies of np.ma.MaskedConstant from being created by .view.,9328,numpy/ma/core.py
4ff8d0a,Eric Wieser,2017-06-30 22:29:25,BUG: Prevent copies of np.ma.MaskedConstant from being created by .view.,9328,numpy/ma/tests/test_core.py
6a96a44,Eric Wieser,2017-06-27 13:02:59,TST: Verify that sorting subarrays is fixed,8069,numpy/ma/tests/test_core.py
1b209d0,Julian Taylor,2017-06-27 10:47:33,BUG: fix wrong ndim used in empty where check,9304,numpy/core/tests/test_multiarray.py
715daa9,Eric Wieser,2017-06-27 00:32:17,BUG: Fix gh-8069,8069,numpy/ma/core.py
715daa9,Eric Wieser,2017-06-27 00:32:17,BUG: Fix gh-8069,8069,numpy/ma/tests/test_core.py
7bd7283,Julian Taylor,2017-06-10 12:23:04,BUG: don't elide into readonly and updateifcopy temporaries,9232,numpy/core/tests/test_multiarray.py
8042526,Bob Eldering,2017-06-13 16:05:12,TST: add test case described in ticket 9228 for numpy.f2py,9228,numpy/f2py/tests/test_common.py
dc063ad,Bob Eldering,2017-06-12 15:37:07,BUG: fix missing keyword rename for common block to numpy.f2py,9228,numpy/f2py/crackfortran.py
d47ca7b,Eric Wieser,2017-04-29 12:38:20,BUG: Check for warnings in ufunc.reduce,8954,numpy/core/tests/test_multiarray.py
d47ca7b,Eric Wieser,2017-04-29 12:38:20,BUG: Check for warnings in ufunc.reduce,8954,numpy/core/tests/test_ufunc.py
d47ca7b,Eric Wieser,2017-04-29 12:38:20,BUG: Check for warnings in ufunc.reduce,8954,numpy/core/tests/test_umath.py
3c0b4db,Antoine Pitrou,2017-05-23 16:46:06,BUG: have as_strided() keep custom dtypes,9161,numpy/lib/stride_tricks.py
3c0b4db,Antoine Pitrou,2017-05-23 16:46:06,BUG: have as_strided() keep custom dtypes,9161,numpy/lib/tests/test_stride_tricks.py
e52efca,Konrad Kapp,2017-05-20 12:50:15,BUG: set default type for empty index array to `numpy.intp` (#9142),9142,numpy/lib/arraysetops.py
e52efca,Konrad Kapp,2017-05-20 12:50:15,BUG: set default type for empty index array to `numpy.intp` (#9142),9142,numpy/lib/tests/test_arraysetops.py
fb67d49,Julian Taylor,2017-05-12 17:28:47,BUG: do not elide complex abs(),9109,numpy/core/tests/test_multiarray.py
59fbc7d,Eric Wieser,2017-05-09 17:40:05,BUG: Don't silence errors in bool(object_array),9078
d7d1b2a,davidjn,2017-05-07 16:26:17,BUG: Move ctypes ImportError catching to appropriate place (#8898),8898,numpy/core/_internal.py
d7d1b2a,davidjn,2017-05-07 16:26:17,BUG: Move ctypes ImportError catching to appropriate place (#8898),8898,numpy/core/tests/test_multiarray.py
37d756c,Eric Wieser,2017-03-22 22:22:28,BUG: Remove mutable state from AxisConcatenator,8815,numpy/lib/index_tricks.py
37d756c,Eric Wieser,2017-03-22 22:22:28,BUG: Remove mutable state from AxisConcatenator,8815,numpy/lib/tests/test_index_tricks.py
3c4545f,Eric Wieser,2017-05-05 12:24:03,BUG: Fix non-determinism in order of fields created from pep3118 formats,9053,numpy/core/_internal.py
3c4545f,Eric Wieser,2017-05-05 12:24:03,BUG: Fix non-determinism in order of fields created from pep3118 formats,9053,numpy/core/tests/test_multiarray.py
fed2e1a,Eric Wieser,2017-05-05 11:40:23,"ENH: Pad with itemsize, not padding fields",9053,numpy/core/_internal.py
fed2e1a,Eric Wieser,2017-05-05 11:40:23,"ENH: Pad with itemsize, not padding fields",9053,numpy/core/tests/test_multiarray.py
67bfabf,Julian Taylor,2017-05-04 22:47:24,"BUG: distutils, add compatiblity python parallelization",7139,numpy/distutils/ccompiler.py
89d7d1d,Eric Wieser,2017-04-26 17:34:41,DOC: Release note and docstring,8963,numpy/core/arrayprint.py
105557a,Charles Harris,2017-04-28 14:33:29,BUG: Make ndarray inplace operators forward calls when needed.,9019,numpy/core/tests/test_multiarray.py
a77709c,Eric Wieser,2017-04-27 23:02:43,BUG: Fix incorrect behavior of nanfunctions on object arrays,8974,numpy/lib/nanfunctions.py
a77709c,Eric Wieser,2017-04-27 23:02:43,BUG: Fix incorrect behavior of nanfunctions on object arrays,8974,numpy/lib/tests/test_nanfunctions.py
05f4228,Eric Wieser,2017-04-26 19:17:08,BUG: Return scalars from ufunclike objects,8993,numpy/lib/tests/test_ufunclike.py
05f4228,Eric Wieser,2017-04-26 19:17:08,BUG: Return scalars from ufunclike objects,8993,numpy/lib/ufunclike.py
628f7b6,Eric Wieser,2017-04-26 17:49:29,DEP: Deprecate calling the `out` argument `y`,8995,numpy/lib/tests/test_ufunclike.py
628f7b6,Eric Wieser,2017-04-26 17:49:29,DEP: Deprecate calling the `out` argument `y`,8995,numpy/lib/ufunclike.py
ae3d1fa,Eric Wieser,2017-04-25 20:24:57,DOC: Explain the behavior of diff on unsigned types,2522,numpy/lib/function_base.py
1e65a2a,Eric Wieser,2017-04-20 12:06:45,BUG: Prevent infinite recursion when printing self-containing arrays,8960,numpy/core/arrayprint.py
1e65a2a,Eric Wieser,2017-04-20 12:06:45,BUG: Prevent infinite recursion when printing self-containing arrays,8960,numpy/core/tests/test_arrayprint.py
e3f8b93,Eric Wieser,2017-04-22 01:45:39,BUG: Prevent VOID_copyswapn ignoring strides,8210,numpy/core/tests/test_multiarray.py
c926d0a,Eric Wieser,2017-04-07 00:37:00,BUG: Correctly distinguish between 0d arrays and scalars,8684,numpy/ma/core.py
c926d0a,Eric Wieser,2017-04-07 00:37:00,BUG: Correctly distinguish between 0d arrays and scalars,8684,numpy/ma/tests/test_core.py
c926d0a,Eric Wieser,2017-04-07 00:37:00,BUG: Correctly distinguish between 0d arrays and scalars,8684,numpy/ma/tests/test_subclassing.py
633568e,Eric Wieser,2017-04-06 22:56:30,ENH: Don't allow lists to become strings iff they are empty,8902,numpy/core/tests/test_multiarray.py
a770387,Eric Wieser,2017-04-06 22:39:49,BUG: Don't call float when constructing longdouble arrays,8902,numpy/core/tests/test_multiarray.py
54487a8,Eric Wieser,2017-04-06 22:21:19,BUG: Don't call str when constructing unicode arrays,5049,numpy/core/tests/test_multiarray.py
fa56437,Eric Wieser,2017-02-19 14:07:03,BUG: Fix double-wrapping of object scalars,8642,numpy/lib/shape_base.py
fa56437,Eric Wieser,2017-02-19 14:07:03,BUG: Fix double-wrapping of object scalars,8642,numpy/lib/tests/test_shape_base.py
a6c3d0e,Simon Gibbons,2017-04-01 21:59:53,BUG: Ensure Errors are correctly checked when PyFloat_AsDouble is called.,8865,numpy/random/tests/test_random.py
63c5082,Eric Wieser,2017-03-25 16:00:39,STY: Fix bad style in umath_linalg (#8825),8756
a7203f9,Eric Wieser,2017-03-21 13:09:34,BUG: Prevent silent failure of ternary power,8805,numpy/core/tests/test_scalarmath.py
3e297ba,Charles Harris,2017-03-13 12:33:34,Merge pull request #8781 from charris/revert-8570,8570
7c00cd7,Charles Harris,2017-03-13 11:47:58,Revert gh-8570.,8570,numpy/random/tests/test_random.py
18b7cd9,Eric Wieser,2017-03-09 02:57:18,BUG: Prevent crash in poly1d.__eq__,8760,numpy/lib/polynomial.py
18b7cd9,Eric Wieser,2017-03-09 02:57:18,BUG: Prevent crash in poly1d.__eq__,8760,numpy/lib/tests/test_polynomial.py
2d229ef,Eric Wieser,2017-02-10 15:00:56,BUG: Make np.ma.where delegate to np.where,8600,numpy/ma/core.py
2d229ef,Eric Wieser,2017-02-10 15:00:56,BUG: Make np.ma.where delegate to np.where,8600,numpy/ma/tests/test_core.py
11c5a9f,Eric Wieser,2017-02-23 14:55:01,BUG: Make MaskedArray.argsort and MaskedArray.sort consistent,8664,numpy/lib/tests/test_arraysetops.py
11c5a9f,Eric Wieser,2017-02-23 14:55:01,BUG: Make MaskedArray.argsort and MaskedArray.sort consistent,8664,numpy/ma/core.py
11c5a9f,Eric Wieser,2017-02-23 14:55:01,BUG: Make MaskedArray.argsort and MaskedArray.sort consistent,8664,numpy/ma/tests/test_core.py
02f3388,Eric Wieser,2017-02-22 11:07:55,BUG: Preserve identity of dtypes in make_mask_descr,8666,numpy/ma/core.py
02f3388,Eric Wieser,2017-02-22 11:07:55,BUG: Preserve identity of dtypes in make_mask_descr,8666,numpy/ma/tests/test_core.py
35d752c,Zè Vinícius,2017-03-01 10:32:34,BUG: Fix creating a np.matrix from string syntax involving booleans (#8497),8497,numpy/matrixlib/defmatrix.py
35d752c,Zè Vinícius,2017-03-01 10:32:34,BUG: Fix creating a np.matrix from string syntax involving booleans (#8497),8497,numpy/matrixlib/tests/test_defmatrix.py
d60ff8e,Charles Harris,2017-02-26 16:23:03,BUG: Fix deepcopy regression for empty arrays.,8536,numpy/core/tests/test_regression.py
05aa44d,Julian Taylor,2017-02-27 14:10:13,BUG: fix ma.median for empty ndarrays,8703,numpy/ma/extras.py
05aa44d,Julian Taylor,2017-02-27 14:10:13,BUG: fix ma.median for empty ndarrays,8703,numpy/ma/tests/test_extras.py
d7d3e21,Charles Harris,2017-02-24 13:58:48,MAINT: Fix use of Python 2.6 deprecated escape sequences.,8687,numpy/core/code_generators/genapi.py
d7d3e21,Charles Harris,2017-02-24 13:58:48,MAINT: Fix use of Python 2.6 deprecated escape sequences.,8687,numpy/lib/function_base.py
60961dd,Matthew Brett,2017-02-21 21:11:50,BUG: allow for precision > 20 in longdouble repr,7940,numpy/core/tests/test_longdouble.py
0a47600,Shota Kawabuchi,2016-09-19 03:10:22,BUG: Look up methods on MaskedArray in _frommethod,8019,numpy/ma/core.py
0a47600,Shota Kawabuchi,2016-09-19 03:10:22,BUG: Look up methods on MaskedArray in _frommethod,8019,numpy/ma/tests/test_core.py
10bf55e,Eric Wieser,2017-02-10 15:03:24,"BUG: Fix #8510, making MaskedArray.__setitem__ work",8510,numpy/ma/core.py
10bf55e,Eric Wieser,2017-02-10 15:03:24,"BUG: Fix #8510, making MaskedArray.__setitem__ work",8510,numpy/ma/tests/test_core.py
5bd7bf9,Matthew Brett,2017-02-09 18:53:03,BUG: match hard-coded finfo to calculated MachAr,8585,numpy/core/getlimits.py
5bd7bf9,Matthew Brett,2017-02-09 18:53:03,BUG: match hard-coded finfo to calculated MachAr,8585,numpy/core/tests/test_getlimits.py
1c8ecc7,Roland Kaufmann,2017-01-22 20:24:07,Fix building extensions with MinGW in WinPython 3.4 (#8454),8454,numpy/distutils/mingw32ccompiler.py
b1b67d6,Ben Rowland,2016-12-31 16:52:47,BUG: Fix apply_along_axis() for when func1d() returns a non-ndarray (#8426),8426,numpy/lib/shape_base.py
b1b67d6,Ben Rowland,2016-12-31 16:52:47,BUG: Fix apply_along_axis() for when func1d() returns a non-ndarray (#8426),8426,numpy/lib/tests/test_shape_base.py
ff4758f,Julian Taylor,2016-12-06 00:37:53,BUG: handle unmasked NaN in ma.median like normal median,8340,numpy/lib/function_base.py
ff4758f,Julian Taylor,2016-12-06 00:37:53,BUG: handle unmasked NaN in ma.median like normal median,8340,numpy/lib/tests/test_nanfunctions.py
ff4758f,Julian Taylor,2016-12-06 00:37:53,BUG: handle unmasked NaN in ma.median like normal median,8340,numpy/lib/utils.py
ff4758f,Julian Taylor,2016-12-06 00:37:53,BUG: handle unmasked NaN in ma.median like normal median,8340,numpy/ma/extras.py
ff4758f,Julian Taylor,2016-12-06 00:37:53,BUG: handle unmasked NaN in ma.median like normal median,8340,numpy/ma/tests/test_extras.py
ba6fdac,Julian Taylor,2016-12-11 20:35:50,BUG: fix nanpercentile not returning scalar with axis argument,8220,numpy/lib/nanfunctions.py
ba6fdac,Julian Taylor,2016-12-11 20:35:50,BUG: fix nanpercentile not returning scalar with axis argument,8220,numpy/lib/tests/test_nanfunctions.py
df00a6f,gfyoung,2016-12-06 14:48:03,BUG: Apply more robust string converts in loadtxt,8033,numpy/lib/npyio.py
df00a6f,gfyoung,2016-12-06 14:48:03,BUG: Apply more robust string converts in loadtxt,8033,numpy/lib/tests/test_io.py
d2542d5,Ralf Gommers,2016-11-26 20:28:41,BLD: blacklist powl (longdouble power function) on OS X.  Closes gh-8307.,8307
e80b948,ahaldane,2016-11-25 10:45:13,Merge pull request #8235 from J-Sand/invalid-structured-dtypes-fix,2865
9fe73dd,James Sanders,2016-11-04 19:46:01,BUG: add checks for some invalid structured dtypes.,2865,numpy/core/tests/test_regression.py
8df25b2,Ralf Gommers,2016-11-24 22:03:15,"BUG: do not link to Accelerate if OpenBLAS, MKL or BLIS are found.",8293,numpy/distutils/system_info.py
105592f,Charles Harris,2016-11-04 10:37:35,DOC: Fixups for quickstart.rst.,7881
5059202,wrwrwr,2016-10-28 01:50:31,"MAINT, DOC: Update some scipy.stats references.",5813
2a4dd99,Shota Kawabuchi,2016-10-22 12:26:46,BUG: Fix subarray format changed in #8160,8160,numpy/core/arrayprint.py
2a4dd99,Shota Kawabuchi,2016-10-22 12:26:46,BUG: Fix subarray format changed in #8160,8160,numpy/core/tests/test_arrayprint.py
7c5163a,Charles Harris,2016-10-18 10:19:30,Merge pull request #8160 from skwbc/issue#5692,5692
3d75c3f,Shota Kawabuchi,2016-10-15 21:56:24,BUG: fix _array2string for strustured array (issue #5692),5692,numpy/core/arrayprint.py
3d75c3f,Shota Kawabuchi,2016-10-15 21:56:24,BUG: fix _array2string for strustured array (issue #5692),5692,numpy/core/tests/test_arrayprint.py
a233689,Antti Kaihola,2016-10-12 23:17:23,"BUG: Make assert_allclose(..., equal_nan=False) work.",8142,numpy/testing/utils.py
d8d7c25,Allan Haldane,2016-10-11 14:47:11,BUG: np.ma.mean and var should return scalar if no mask,5769,numpy/ma/core.py
d8d7c25,Allan Haldane,2016-10-11 14:47:11,BUG: np.ma.mean and var should return scalar if no mask,5769,numpy/ma/tests/test_core.py
5d0ce36,Jonathan Helmus,2016-10-12 13:07:42,BUG: import full module path in npy_load_module,8147,numpy/compat/py3k.py
5b38e86,Julian Taylor,2016-10-11 19:05:57,MAINT: make sure __builtin_cpu_supports is not optimized away,8130,numpy/core/setup_common.py
b5471e0,Julian Taylor,2016-10-11 19:03:02,MAINT: check that linker can handle AVX,8128,numpy/core/setup.py
b5471e0,Julian Taylor,2016-10-11 19:03:02,MAINT: check that linker can handle AVX,8128,numpy/core/setup_common.py
f236760,Eric Moore,2016-04-30 22:45:50,BUG: integer 0 to a negative power should error.,7510,numpy/core/tests/test_regression.py
f236760,Eric Moore,2016-04-30 22:45:50,BUG: integer 0 to a negative power should error.,7510,numpy/core/tests/test_umath.py
8888a76,Raghav RV,2016-10-06 23:30:50,BUG: Fix broken pickle in MaskedArray when dtype is object (#8122),8122,numpy/ma/core.py
8888a76,Raghav RV,2016-10-06 23:30:50,BUG: Fix broken pickle in MaskedArray when dtype is object (#8122),8122,numpy/ma/tests/test_core.py
36f8844,naveenarun,2016-09-21 23:31:51,BUG: financial.pmt modifies input #8055,8055,numpy/lib/financial.py
36f8844,naveenarun,2016-09-21 23:31:51,BUG: financial.pmt modifies input #8055,8055,numpy/testing/utils.py
7efef9d,Allan Haldane,2016-09-21 21:22:55,BUG: non-integers can end up in dtype offsets,8059,numpy/core/tests/test_dtype.py
8dff1ca,Charles Harris,2016-09-19 12:23:17,Merge pull request #8061 from KhaledTo/issue#8055,8055
7c8043e,KhaledTo,2016-09-18 22:00:24,BUG : financial.pmt modifies input (issue #8055),8055,numpy/lib/financial.py
66f313f,Charles Harris,2016-09-04 12:18:05,BUG: Fix numpy.ma.median for various things.,8015,numpy/ma/extras.py
0ade4c4,Charles Harris,2016-07-20 11:09:36,BUG: Make sure numpy globals keep identity after reload.,7844,numpy/__init__.py
0ade4c4,Charles Harris,2016-07-20 11:09:36,BUG: Make sure numpy globals keep identity after reload.,7844,numpy/_globals.py
0ade4c4,Charles Harris,2016-07-20 11:09:36,BUG: Make sure numpy globals keep identity after reload.,7844,numpy/tests/test_reloading.py
3984786,Charles Harris,2016-08-14 14:58:30,BUG: Guard against buggy comparisons in generic quicksort.,7934,numpy/core/tests/test_multiarray.py
5130ef1,ahaldane,2016-08-08 12:01:07,Merge pull request #7911 from skwbc/fix_issue#7835,7835
af671c4,Shota Kawabuchi,2016-08-07 04:59:49,BUG: fix for issue#7835 (ma.median of 1d),7835,numpy/ma/extras.py
af671c4,Shota Kawabuchi,2016-08-07 04:59:49,BUG: fix for issue#7835 (ma.median of 1d),7835,numpy/ma/tests/test_extras.py
b9b42ee,Charles Harris,2016-07-20 11:09:36,BUG: Raise RuntimeError when reloading numpy is attempted.,7844,numpy/__init__.py
b9b42ee,Charles Harris,2016-07-20 11:09:36,BUG: Raise RuntimeError when reloading numpy is attempted.,7844,numpy/tests/test_reloading.py
6685ee8,Ralf Gommers,2016-07-11 07:30:18,Merge pull request #7818 from emmenlau/master,7809
3e39614,Charles Harris,2016-07-10 14:50:59,MAINT: Allocate fewer bytes for empty arrays.,7813
e65375e,Mario Emmenlauer,2016-07-10 20:05:41,numpy/distutils/misc_util.py fix for #7809: check that _tmpdirs is not None,7809,numpy/distutils/misc_util.py
f14ad75,Yu Feng,2016-02-02 16:22:42,BUG: Invalid read of size 4 in PyArray_FromFile,7756
24ee6b3,badhrink,2016-06-10 16:11:47,DOC: Corrections in Datetime Units-arrays.datetime.rst,6711
5657a6c,Simon Gibbons,2016-06-09 13:11:53,BUG: Fix segfaults in np.random.shuffle,7710,numpy/random/tests/test_regression.py
080c433,gfyoung,2016-06-07 22:10:34,BUG: Remove memory leak in np.place,7714
c125956,Charles Harris,2016-06-03 11:07:56,Merge pull request #7688 from rgommers/genfromtxt-examples,7662
0bf9478,Sebastian Berg,2016-05-23 19:44:54,BUG: Fix unicode with byte swap transfer and copyswap,3939
e928bd9,Ralf Gommers,2016-05-27 21:20:38,DOC: fix broken genfromtxt examples in user guide.  Closes gh-7662.,7662
